author,tags,text
"J.K. Rowling,","humor,trust","Ginny!"" said Mr. Weasley, flabbergasted. ""Haven't I taught you anything? What have I always told you? Never trust anything that can think for itself if you can't see where it keeps its brain?"
"Santosh Kalwar,","addiction,life-lessons,philosophy,thinking,thoughts",We are addicted to our thoughts. We cannot change anything if we cannot change our thinking.
Gail Carson Levine,,A library is infinity under a roof.
Terry Pratchett,,"It's not worth doing something unless someone, somewhere, would much rather you weren't doing it."
"Cassandra Clare,","clockwork-angel,will-herondale,william-herondale","Sometimes, when I have to do something I don't want to do, I pretend I'm a character from a book. It's easier to know what they would do."
"Oscar Wilde,","aesthetics,appreciation,hidden-things","Behind every exquisite thing that existed, there was something tragic."
Roy T. Bennett,"experience,gratitude,inspiration,inspirational,inspirational-quotes,inspire,inspiring,life,life-quotes,living,optimism,optimistic,positive,positive-affirmation,positive-life,positive-thinking,thankful",Be thankful for everything that happens in your life; it’s all an experience.
"مصطفى محمود,",,الكراهية تكلف أكثر من الحب.. لأنها إحساس غير طبيعي.. إحساس عكسي مثل حركة الأجسام ضد جاذبية الأرض.. تحتاج إلى قوة إضافية وتستهلك وقوداً أكثر
"Pablo Neruda,",,so I wait for you like a lonely house
"Margaret Mitchell,",,Burdens are for shoulders strong enough to carry them.
Charlotte Brontë,"companionship,loneliness,marriage,single,spinsterhood","The trouble is not that I am single and likely to stay single, but that I am lonely and likely to stay lonely."
Ray Bradbury,writing,"You must write every single day of your life... You must lurk in libraries and climb the stacks like ladders to sniff books like perfumes and wear books like hats upon your crazy heads... may you be in love every day for the next 20,000 days. And out of that love, remake a world."
Sophocles,"love,pain",One word
Charles Bukowski,,Boring damned people. All over the earth. Propagating more boring damned people. What a horror show. The earth swarmed with them.
John Muir,inspirational,"When one tugs at a single thing in nature, he finds it attached to the rest of the world."
Mark Twain,"bravery,dog,famous,inspirational,valour","It's not the size of the dog in the fight, it's the size of the fight in the dog."
"Edgar Allan Poe,","hopelessness,pain","Once upon a midnight dreary, while I pondered, weak and weary,"
Lillian Hellman,,People change and forget to tell each other.
C.S. Lewis,writing,You can make anything by writing.
"Veronica Roth,",,It must require bravery to be honest all the time.
"Cassandra Clare,","humor,jace",Jace shook his blond head in exasperation.
"Evelyn Waugh,",,"Sometimes, I feel the past and the future pressing so hard on either side that there's no room for the present at all."
"William Goldman,","book,fantasy,humour","When I was your age, television was called books."
"Brian Jacques,",,"Even the strongest and bravest must sometimes weep. It shows they have a great heart, one that can feel compassion for others."
Albert Schweitzer,"attributed-no-source,cats,life,music",There are two means of refuge from the misery of life — music and cats.
Albert Einstein,humor,Black holes are where God divided by zero.
"Margaret Atwood,",inspirational,Don't let the bastards grind you down.
"Emilie Autumn,","fight,friends,friendship,kill,loyalty,strength","It gives me strength to have somebody to fight for; I can never fight for myself, but, for others, I can kill."
Robert Louis Stevenson,life,"Life is not a matter of holding good cards, but of playing a poor hand well."
W.C. Fields,"labels,names","It ain't what they call you, it's what you answer to."
Stanislaw Lem,,"Good books tell the truth, even when they're about things that never have been and never will be. They're truthful in a different way."
"Richelle Mead,","academy,mead,richelle,vampire",The only thing better than imagining Dimitri carrying me in his arms was imagining him shirtless while carrying me in his arms.
"J. K. Rowling,",dumbledore,"What happened down in the dungeons between you and Professor Quirrell is a complete secret, so, naturally the whole school knows."
Henry Wadsworth Longfellow,"books,learning,love,serenity","The love of learning, the sequestered nooks,"
Franz Kafka,reading,"I think we ought to read only the kind of books that wound or stab us. If the book we're reading doesn't wake us up with a blow to the head, what are we reading for? So that it will make us happy, as you write? Good Lord, we would be happy precisely if we had no books, and the kind of books that make us happy are the kind we could write ourselves if we had to. But we need books that affect us like a disaster, that grieve us deeply, like the death of someone we loved more than ourselves, like being banished into forests far from everyone, like a suicide. A book must be the axe for the frozen sea within us. That is my belief."
Neil Gaiman,"books,libraries,library,reading","[D]on't ever apologise to an author for buying something in paperback, or taking it out from a library (that's what they're there for."
E.E. Cummings,"decisions,love,stars,taking-chances","Trust your heart if the seas catch fire, live by love though the stars walk backward."
Sarah Dessen,"inspirational,strength,tough-times","Anyone can hide. Facing up to things, working through them, that's what makes you strong."
Neil Gaiman,writing,Being a writer is a very peculiar sort of a job: it's always you versus a blank sheet of paper (or a blank screen) and quite often the blank piece of paper wins.
Stephen Fry,"advice,depression,friendship,life,self-help","If you know someone who’s depressed, please resolve never to ask them why. Depression isn’t a straightforward response to a bad situation; depression just is, like the weather."
"Sarah J. Maas,",,"She was the heir of ash and fire, and she would bow to no one."
Audrey Hepburn,fairy-tales,If I’m honest I have to tell you I still read fairy-tales and I like them best of all.
"Stieg Larsson,","friendship,incredibly-true,mutuality,reciprocity,respect,trust","Friendship- my definition- is built on two things. Respect and trust. Both elements have to be there. And it has to be mutual. You can have respect for someone, but if you don't have trust, the friendship will crumble."
"John Green,",,You like someone who can't like you back because unrequited love can be survived in a way that once-requited love cannot. 
Sylvia Plath,,Is there no way out of the mind?
"Anne Frank,","beauty,hope,inspirational,joy","I don't think of all the misery, but of the beauty that still remains."
Arrigo Boito,love,"When I saw you I fell in love, and you smiled because you knew."
Stephen King,,I think that we're all mentally ill. Those of us outside the asylums only hide it a little better - and maybe not all that much better after all.
"Daniel Defoe,",,It is never too late to be wise.
"Cornelia Funke,",inkheart,Books have to be heavy because the whole world's inside them.
"Leigh Bardugo,",,"No mourners. No funerals. Among them, it passed for 'good luck."
Ben Okri,stories,"Stories can conquer fear, you know. They can make the heart bigger."
"Chuck Palahniuk,",life,"No matter how careful you are, there's going to be the sense you missed something, the collapsed feeling under your skin that you didn't experience it all. There's that fallen heart feeling that you rushed right through the moments where you should've been paying attention."
Boris Pasternak,life,I don't like people who have never fallen or stumbled. Their virtue is lifeless and it isn't of much value. Life hasn't revealed its beauty to them. 
"Stephen Chbosky,","common-experience,unity","And all the books you've read have been read by other people. And all the songs you've loved have been heard by other people. And that girl that's pretty to you is pretty to other people. and that if you looked at these facts when you were happy, you would feel great because you are describing 'unity."
"Roy T. Bennett,","be-yourself,inspiration,inspirational,inspirational-attitude,inspirational-life,inspirational-quotes,inspire,inspiring,life,life-and-living,life-lessons,life-quotes,living,optimism,optimistic,positive,positive-affirmation,positive-life,positive-thinking",Sometimes you have to lose all you have to find out who you truly are.
"Tahereh Mafi,","moon,spiritual",The moon is a loyal companion.
"Ursula K. Le Guin,","goals,journey,travel","It is good to have an end to journey toward; but it is the journey that matters, in the end."
Edgar Allan Poe,"heartache,loss,love","From childhood's hour I have not been. As others were, I have not seen. As others saw, I could not awaken. My heart to joy at the same tone. And all I loved, I loved alone."
"Nicholas Sparks,","love,separation","I fell in love with her when we were together, then fell deeper in love with her in the years we were apart."
Jim Butcher,family,"When everything goes to hell, the people who stand by you without flinching -- they are your family. "
"Randy Pausch,","barriers,challenges,failure,failures,inspirational,perseverance",The brick walls are there for a reason. The brick walls are not there to keep us out. The brick walls are there to give us a chance to show how badly we want something. Because the brick walls are there to stop the people who don’t want it badly enough. They’re there to stop the other people.
Maya Angelou,inspirational,A woman's heart should be so hidden in God that a man has to seek Him just to find her.
James Baldwin,"parenting,role-models","Children have never been very good at listening to their elders, but they have never failed to imitate them."
"F. Scott Fitzgerald,",demographics,"There are only the pursued, the pursuing, the busy and the tired."
"J.D. Salinger,","friendship,insincerity,manners","I am always saying ""Glad to've met you"" to somebody I'm not at all glad I met. If you want to stay alive, you have to say that stuff, though."
Steve Jobs,,Remembering that you are going to die is the best way I know to avoid the trap of thinking you have something to lose. You are already naked. There is no reason not to follow your heart.
"Marcus Aurelius ,",truth,"Everything we hear is an opinion, not a fact. Everything we see is a perspective, not the truth."
Joyce Carol Oates,reading,"Reading is the sole means by which we slip, involuntarily, often helplessly, into another's skin, another's voice, another's soul."
"Suzanne Collins,","katniss-everdeen,peeta-mellark",You're a painter. You're a baker. You like to sleep with the windows open. You never take sugar in your tea. And you always double-knot your shoelaces.
"Jodi Picoult,","death,loss,sisters","If you have a sister and she dies, do you stop saying you have one? Or are you always a sister, even when the other half of the equation is gone?"
"Laurell K. Hamilton,","inspirational,love,relationships","I will love you always. When this red hair is white, I will still love you. When the smooth softness of youth is replaced by the delicate softness of age, I will still want to touch your skin. When your face is full of the lines of every smile you have ever smiled, of every surprise I have seen flash through your eyes, when every tear you have ever cried has left its mark upon your face,I will treasure you all the more, because I was there to see it all. I will share your life with you, Meredith, and I will love you until the last breath leaves your body or mine."
"Stephen Chbosky,","happiness,inspirational,life","please believe that things are good with me, and even when they're not, they will be soon enough. And i will always believe the same about you."
"Charles Dickens,","communication,psychology","A wonderful fact to reflect upon, that every human creature is constituted to be that profound secret and mystery to every other."
Mahatma Gandhi,"attributed-no-source,discovery,identity,self-discovery,service",The best way to find yourself is to lose yourself in the service of others.
Steve Martin,"humor,words","Some people have a way with words, and other people...oh, uh, not have way."
"Tahereh Mafi,",,Books are easily destroyed. But words will live as long as people can remember them.
"Agatha Christie,",,Very few of us are what we seem.
"Stephenie Meyer,",memory,"Forbidden to remember, terrified to forget; it was a hard line to walk."
Harlan Ellison,"ignorance,intelligence,opinions,stupidity",You are not entitled to your opinion. You are entitled to your
Phyllis Diller,humor,A smile is a curve that sets everything straight.
Jean de La Fontaine,,"Rare as is true love, true friendship is rarer."
"Richelle Mead,","funny,sweet","Did you see that dress? ""I saw the dress. ""Did you like it? He didn't answer. I took that as a yes. ""Am I going to endanger my reputation if I wear it to the dance? When he spoke, I could barely hear him. ""You'll endanger the school. I smiled and fell asleep."
Gustave Flaubert,,"Do not read as children do to enjoy themselves, or, as the ambitious do to educate themselves. No, read to live."
Virginia Woolf,writing,"Writing is like sex. First you do it for love, then you do it for your friends, and then you do it for money."
Harvey Fierstein,"be-yourself,identity,individuality,inspirational,life,self-determination,self-esteem,self-expression","Never be bullied into silence. Never allow yourself to be made a victim. Accept no one's definition of your life, but define yourself."
"Sylvia Plath,",,I desire the things that will destroy me in the end.
"Stieg Larsson,","adoration,infatuation,love",What she had realized was that love was that moment when your heart was about to burst.
"Cassandra Clare,","grief,healing,magnus-bane,time,will-herondale","They say time heals all wounds, but that presumes the source of the grief is finite"
"Nicholas Sparks,","at-first-sight,emotions,healing,heartbreak,love,nicholas,nicholas-sparks,sparks",The emotion that can break your heart is sometimes the very one that heals it...
"Lao Tzu,","ataraxy,be-yourself,integrity,self-reliance,self-respect","When you are content to be simply yourself and don't compare or compete, everyone will respect you."
"Chuck Palahniuk,","hate,self-loathing","When we don't know who to hate, we hate ourselves."
Cassandra Clare,"humor,jace-wayland,the-mortal-instruments,tmi",My rapier wit hides my inner pain.
"J.M. Barrie,",happiness,"When the first baby laughed for the first time, its laugh broke into a thousand pieces, and they all went skipping about, and that was the beginning of fairies."
P.C. Cast  Kristin Cast,friendship,"If you have good friends, no matter how much life is sucking , they can make you laugh."
Charles Lamb,"humor,work","I always arrive late at the office, but I make up for it by leaving early."
"Honoré de Balzac,","human-nature,love","The more one judges, the less one loves."
"Jamie McGuire,",love,"I know we're fucked up, alright? I'm impulsive, and hot tempered, and you get under my skin like no one else. You act like you hate me one minute, and then need me the next. I never get anything right, and I don't deserve you...but I fucking love you, Abby. I love you more than I loved anyone or anything ever. When you're around, I don't need booze, or money, or the fighting, or the one-night stands..."
Anais Nin,,"I am only responsible for my own heart, you offered yours up for the smashing my darling. Only a fool would give out such a vital organ"
Bob Dylan,"beautiful,behind,kind,of,pain,thing","Behind every beautiful thing, there's some kind of pain."
"Glen Cook,","morning,waking-up",Morning is wonderful. Its only drawback is that it comes at such an inconvenient time of day.
"Jack Kornfield,","eastern-philosophy,inspirational",In the end
Dr. Seuss,"dr-seuss,goodbye","Remember me and smile, for it's better to forget than to remember me and cry."
Ira Glass,,"Nobody tells this to people who are beginners, I wish someone told me. All of us who do creative work, we get into it because we have good taste. But there is this gap. For the first couple years you make stuff, it’s just not that good. It’s trying to be good, it has potential, but it’s not. But your taste, the thing that got you into the game, is still killer. And your taste is why your work disappoints you. A lot of people never get past this phase, they quit. Most people I know who do interesting, creative work went through years of this. We know our work doesn’t have this special thing that we want it to have. We all go through this. And if you are just starting out or you are still in this phase, you gotta know its normal and the most important thing you can do is do a lot of work. Put yourself on a deadline so that every week you will finish one story. It is only by going through a volume of work that you will close that gap, and your work will be as good as your ambitions. And I took longer to figure out how to do this than anyone I’ve ever met. It’s gonna take awhile. It’s normal to take awhile. You’ve just gotta fight your way through."
Edward Abbey,truth,Better a cruel truth than a comfortable delusion.
"Robert Louis Stevenson,","books,inspirational,on-writing,reading","I kept always two books in my pocket, one to read, one to write in."
Mark Twain,humor,"I've lived through some terrible things in my life, some of which actually happened."
"Jane Austen,",happiness,I must learn to be content with being happier than I deserve.
Mother Teresa,paraphrased,Do not think that love in order to be genuine has to be extraordinary. What we need is to love without getting tired. Be faithful in small things because it is in them that your strength lies.
"Chuck Palahniuk,",unique,"You are not special. You're not a beautiful and unique snowflake. You're the same decaying organic matter as everything else. We're all part of the same compost heap. We're all singing, all dancing crap of the world."
"John Green,","funny,humor,humour,internet,john-green,pedophile,pedophilia,tfios,the-fault-in-our-stars","Headline?"" he asked."
Georg Wilhelm Friedrich Hegel,,Nothing great in the world was accomplished without passion.
"Jo Walton,",books,"It doesn't matter. I have books, new books, and I can bear anything as long as there are books."
Tim Burton,"craziness,insanity,perspective,reality,sanity",One person's craziness is another person's reality.
"Lauren Oliver,","independence,lena-holoway,self-determination,self-reliance",I'd rather die my way than live yours.
"Yann Martel,",life,To choose doubt as a philosophy of life is akin to choosing immobility as a means of transportation.
Mother Teresa,misattributed-to-mother-teresa,"Kind words can be short and easy to speak, but their echoes are truly endless."
"Andy Warhol,","change,initiative,time","They always say time changes things, but you actually have to change them yourself."
Hunter S. Thompson,,"I hate to advocate drugs, alcohol, violence, or insanity to anyone, but they've always worked for me."
Marilyn Monroe,,Sometimes things fall apart so that better things can fall together
"Paulo Coelho,",fear,"Don't give in to your fears. If you do, you won't be able to talk to your heart."
"J.K. Rowling,","humor,school","I hope you're pleased with yourselves. We could all have been killed - or worse, expelled. Now if you don't mind, I'm going to bed."
Heinrich Heine,"music,power-of-music","Where words leave off, music begins."
Aung San Suu Kyi,civil-rights,"The only real prison is fear, and the only real freedom is freedom from fear"
"Sarah J. Maas,",,You cannot pick and choose what parts of her to love.
Lawrence Ferlinghetti,"beatnik,cynical,funny,humour",If you're too open-minded; your brains will fall out.
Anthony Powell,,I get a warm feeling among my books.
Mahatma Gandhi,"bravery,god,goodness,humanity,justice,kindness,peace,suffering",Let the first act of every morning be to make the following resolve for the day:
Oscar Wilde,selfishness,"Selfishness is not living as one wishes to live, it is asking others to live as one wishes to live."
Dante Alighieri,,My course is set for an uncharted sea.
"Rita Mae Brown,",love,"Sorrow is how we learn to love. Your heart isn't breaking. It hurts because it's getting larger. The larger it gets, the more love it holds."
Virginia Woolf,women,"As a woman I have no country. As a woman I want no country. As a woman, my country is the whole world."
Martin Luther King Jr.,challanges,"The ultimate measure of a man is not where he stands in moments of comfort and convenience, but where he stands at times of challenge and controversy."
"J.K. Rowling,","harry-potter,humor,malfoy,ron-weasley,snape,unbreakable-vow","An Unbreakable Vow?"" said Ron, looking stunned. ""Nah, he can’t have.... Are you sure?"""
John Lennon,"beatles,destiny,fate,life",There's nowhere you can be that isn't where you're meant to be...
"Neil Gaiman,",sandman,"Things need not have happened to be true. Tales and dreams are the shadow-truths that will endure when mere facts are dust and ashes, and forgot."
"Charles Darwin,","arts,life,music,poetry","If I had my life to live over again, I would have made a rule to read some poetry and listen to some music at least once every week."
Eleanor Roosevelt,love,"It takes courage to love, but pain through love is the purifying fire which those who love generously know. We all know people who are so much afraid of pain that they shut themselves up like clams in a shell and, giving out nothing, receive nothing and therefore shrink until life is a mere living death."
Neil Gaiman,"2012,blog,new-year","I hope that in this year to come, you make mistakes."
C. JoyBell C.,"defiant,freedom,inspirational,inspirational-attitude,inspirational-quotes,inspiring,life-and-living,self-belief,self-love,self-worth,society","Life is too short to waste any amount of time on wondering what other people think about you. In the first place, if they had better things going on in their lives, they wouldn't have the time to sit around and talk about you. What's important to me is not others' opinions of me, but what's important to me is my opinion of myself."
Bob Marley,"freedom,liberty,life,revolution",Better to die fighting for freedom then be a prisoner all the days of your life.
"Rainbow Rowell,","friendship,high-school,love,relationships,sweet,teenage-love","Holding Eleanor's hand was like holding a butterfly. Or a heartbeat. Like holding something complete, and completely alive."
"Kazuo Ishiguro,",memory,"Memories, even your most precious ones, fade surprisingly quickly. But I don’t go along with that. The memories I value most, I don’t ever see them fading."
"Maya Angelou,","2008,advice",Try to be a rainbow in someone's cloud.
Anais Nin,diary-entry,"I am lonely, yet not everybody will do. I don't know why, some people fill the gaps and others emphasize my loneliness. In reality those who satisfy me are those who simply allow me to live with my ''idea of them."
"V. S. Naipaul,",,The only lies for which we are truly punished are those we tell ourselves.
"Sarah   Williams,","poetry,science,stars","Though my soul may set in darkness, it will rise in perfect light;"
Groucho Marx,attributed-no-source,Learn from the mistakes of others. You can never live long enough to make them all yourself.
Don Miguel Ruiz,"spirituality,toltec-wisdom",1. Be Impeccable With Your Word
"Peter S. Beagle,","heroes,inspirational","Great heroes need great sorrows and burdens, or half their greatness goes unnoticed. It is all part of the fairy tale."
"Rainbow Rowell,","fear,friendship,tired,trust","I don’t trust anybody. Not anybody. And the more that I care about someone, the more sure I am they’re going to get tired of me and take off."
Marcel Proust,"discovery,travel","The real voyage of discovery consists not in seeking new landscapes, but in having new eyes."
"Leonard Cohen,","hope,light",There is a crack in everything.
"Roy T. Bennett,","happiness,inspiration,inspirational,inspirational-attitude,inspirational-life,inspirational-quotes,inspire,inspiring,life,life-and-living,life-lessons,life-quotes,living,optimism,optimistic,positive,positive-affirmation,positive-life,positive-thinking","Stop comparing yourself to other people, just choose to be happy and live your own life."
Karen Blixen,,"I know of a cure for everything: salt water...in one way or the other. Sweat, or tears, or the salt sea."
Edmund Burke,evil,The only thing necessary for the triumph of evil is for good men to do nothing.
Warsan Shire,,"My alone feels so good, I'll only have you if you're sweeter than my solitude."
"Nicholas Sparks,",god,"I have faith that God will show you the answer. But you have to understand that sometimes it takes a while to be able to recognize what God wants you to do. That's how it often is. God's voice is usually nothing more than a whisper, and you have to listen very carefully to hear it. But other times, in those rarest of moments, the answer is obvious and rings as loud as a church bell."
Anne Rice,"anne-rice,pandora",You do have a story inside you; it lies articulate and waiting to be written — behind your silence and your suffering.
"Lemony Snicket,",,It is one of life's bitterest truths that bedtime so often arrives just when things are really getting interesting.
"Neil LaBute,",,The future is now. It's time to grow up and be strong. Tomorrow may well be too late.
Anais Nin,"anais-nin,inspirational,living,mermaids,no-fear,sea","I must be a mermaid, Rango. I have no fear of depths and a great fear of shallow living."
"Lauren Oliver,","give,love,sacrifice",I guess that’s just part of loving people: You have to give things up. Sometimes you even have to give them up.
