author,tags,text
Marilyn Monroe,"attributed-no-source,best,life,love,mistakes,out-of-control,truth,worst","I'm selfish, impatient and a little insecure. I make mistakes, I am out of control and at times hard to handle. But if you can't handle me at my worst, then you sure as hell don't deserve me at my best."
Oscar Wilde,"attributed-no-source,be-yourself,honesty,inspirational,misattributed-oscar-wilde",Be yourself; everyone else is already taken.
Albert Einstein,"attributed-no-source,human-nature,humor,infinity,philosophy,science,stupidity,universe",Two things are infinite: the universe and human stupidity; and I'm not sure about the universe.
Frank Zappa,"books,humor","So many books, so little time."
Marcus Tullius Cicero,"attributed-no-source,books,simile,soul",A room without books is like a body without a soul.
Bernard M. Baruch,"ataraxy,be-yourself,confidence,fitting-in,individuality,misattributed-dr-seuss,those-who-matter","Be who you are and say what you feel, because those who mind don't matter, and those who matter don't mind."
William W. Purkey,"dance,heaven,hurt,inspirational,life,love,sing","You've gotta dance like there's nobody watching,"
Dr. Seuss,"attributed-no-source,dreams,love,reality,sleep",You know you're in love when you can't fall asleep because reality is finally better than your dreams.
Mae West,"humor,life","You only live once, but if you do it right, once is enough."
Mahatma Gandhi,"action,change,inspirational,philosophy,wish",Be the change that you wish to see in the world.
Robert Frost,life,In three words I can sum up everything I've learned about life: it goes on.
"J.K. Rowling,",,"If you want to know what a man's like, take a good look at how he treats his inferiors, not his equals."
Albert Camus,"attributed-no-source,friends,friendship,misattributed-albert-camus",Don’t walk in front of me… I may not follow
"Eleanor Roosevelt,",,No one can make you feel inferior without your consent.
Mark Twain,"lies,lying,memory,truth","If you tell the truth, you don't have to remember anything."
"C.S. Lewis,",friendship,"Friendship ... is born at the moment when one man says to another ""What! You too? I thought that no one but myself . . ."
Maya Angelou,,"I've learned that people will forget what you said, people will forget what you did, but people will never forget how you made them feel."
Elbert Hubbard,"friend,friendship,knowledge,love",A friend is someone who knows all about you and still loves you.
Oscar Wilde,"attributed-no-source,enemies,forgiveness,strategy",Always forgive your enemies; nothing annoys them so much.
Oscar Wilde,life,"To live is the rarest thing in the world. Most people exist, that is all."
Mahatma Gandhi,"carpe-diem,education,inspirational,learning",Live as if you were to die tomorrow. Learn as if you were to live forever.
"Martin Luther King Jr.,","darkness,drive-out,hate,inspirational,light,love,peace",Darkness cannot drive out darkness: only light can do that. Hate cannot drive out hate: only love can do that.
"Friedrich Nietzsche,","inspirational,music,philosophy","Without music, life would be a mistake."
"Oscar Wilde,","intelligence,self-deprecation",I am so clever that sometimes I don't understand a single word of what I am saying.
"Stephen Chbosky,","inspirational,love",We accept the love we think we deserve.
Ralph Waldo Emerson,"accomplishment,attributed-no-source,be-yourself,conformity,individuality",To be yourself in a world that is constantly trying to make you something else is the greatest accomplishment.
Rob Siltanen,"advertising,apple,change,commercial,computers,different,madness,misattributed-apple,misattributed-steve-jobs,misfits,nonconformity,progressive,rebels,status-quo,think-different,troublemakers","Here's to the crazy ones. The misfits. The rebels. The troublemakers. The round pegs in the square holes. The ones who see things differently. They're not fond of rules. And they have no respect for the status quo. You can quote them, disagree with them, glorify or vilify them. About the only thing you can't do is ignore them. Because they change things. They push the human race forward. And while some may see them as the crazy ones, we see genius. Because the people who are crazy enough to think they can change the world, are the ones who do."
Narcotics Anonymous,"humor,insanity,life,misattributed-ben-franklin,misattributed-mark-twain,misattributed-to-einstein","Insanity is doing the same thing, over and over again, but expecting different results."
Marilyn Monroe,"attributed-no-source,misattributed-marilyn-monroe","I believe that everything happens for a reason. People change so that you can learn to let go, things go wrong so that you appreciate them when they're right, you believe lies so you eventually learn to trust no one but yourself, and sometimes good things fall apart so better things can fall together."
"H. Jackson Brown Jr.,","actions,disappointed,disappointment,dream,dreams,explore,misattributed-mark-twain,sail",Twenty years from now you will be more disappointed by the things that you didn't do than by the ones you did do. So throw off the bowlines. Sail away from the safe harbor. Catch the trade winds in your sails. Explore. Dream. Discover.
"Andre Gide,","life,love",It is better to be hated for what you are than to be loved for what you are not.
Bob Marley,love,"Only once in your life, I truly believe, you find someone who can completely turn your world around. You tell them things that you’ve never shared with another soul and they absorb everything you say and actually want to hear more. You share hopes for the future, dreams that will never come true, goals that were never achieved and the many disappointments life has thrown at you. When something wonderful happens, you can’t wait to tell them about it, knowing they will share in your excitement. They are not embarrassed to cry with you when you are hurting or laugh with you when you make a fool of yourself. Never do they hurt your feelings or make you feel like you are not good enough, but rather they build you up and show you the things about yourself that make you special and even beautiful. There is never any pressure, jealousy or competition but only a quiet calmness when they are around. You can be yourself and not worry about what they will think of you because they love you for who you are. The things that seem insignificant to most people such as a note, song or walk become invaluable treasures kept safe in your heart to cherish forever. Memories of your childhood come back and are so clear and vivid it’s like being young again. Colours seem brighter and more brilliant. Laughter seems part of daily life where before it was infrequent or didn’t exist at all. A phone call or two during the day helps to get you through a long day’s work and always brings a smile to your face. In their presence, there’s no need for continuous conversation, but you find you’re quite content in just having them nearby. Things that never interested you before become fascinating because you know they are important to this person who is so special to you. You think of this person on every occasion and in everything you do. Simple things bring them to mind like a pale blue sky, gentle wind or even a storm cloud on the horizon. You open your heart knowing that there’s a chance it may be broken one day and in opening your heart, you experience a love and joy that you never dreamed possible. You find that being vulnerable is the only way to allow your heart to feel true pleasure that’s so real it scares you. You find strength in knowing you have a true friend and possibly a soul mate who will remain loyal to the end. Life seems completely different, exciting and worthwhile. Your only hope and security is in knowing that they are a part of your life."
"J.R.R. Tolkien,","frost,glitter,gold,lost,poetry,roots,strength,strong,wander,wither","All that is gold does not glitter,"
"J.K. Rowling,","abilities,choices","It is our choices, Harry, that show what we truly are, far more than our abilities."
"Jane Austen,","aliteracy,books,classic,humor","The person, be it gentleman or lady, who has not pleasure in a good novel, must be intolerably stupid."
Marilyn Monroe,"attributed-no-source,be-yourself,inspirational","Imperfection is beauty, madness is genius and it's better to be absolutely ridiculous than absolutely boring."
Albert Einstein,"attributed-no-source,inspirational,life,live,miracle,miracles",There are only two ways to live your life. One is as though nothing is a miracle. The other is as though everything is a miracle.
"J.K. Rowling,","dreams,life",It does not do to dwell on dreams and forget to live.
Mark Twain,"books,contentment,friends,friendship,life","Good friends, good books, and a sleepy conscience: this is the ideal life."
"John Green,",love,"As he read, I fell in love the way you fall asleep: slowly, and then all at once."
"Oscar Wilde,","inspirational,optimism,perception,pessimism","We are all in the gutter, but some of us are looking at the stars."
"Maurice Switzer,","misattributed-to-abraham-lincoln,misattributed-to-mark-twain,remaining-silent,wisdom","It is better to remain silent at the risk of being thought a fool, than to talk and remove all doubt of it."
"William Shakespeare,",wisdom,"The fool doth think he is wise, but the wise man knows himself to be a fool."
"Neil Gaiman,","books,dragons,fairy-tales,inspirational,paraphrasing-g-k-chesterton","Fairy tales are more than true: not because they tell us that dragons exist, but because they tell us that dragons can be beaten."
Mark Twain,"individuality,majority,minority,pause,reflect,wisdom","Whenever you find yourself on the side of the majority, it is time to reform (or pause and reflect)."
Allen Saunders,"fate,life,misattributed-john-lennon,planning,plans",Life is what happens to us while we are making other plans.
Bill Keane,"attributed-no-source,hope,inspirational,misattributed-eleanor-roosevelt,past,present,widely-misattributed","Yesterday is history, tomorrow is a mystery, today is a gift of God, which is why we call it the present."
Thomas A. Edison,"edison,failure,inspirational,paraphrased","I have not failed. I've just found 10,000 ways that won't work."
Eleanor Roosevelt,"attributed-no-source,misattributed-eleanor-roosevelt",A woman is like a tea bag; you never know how strong it is until it's in hot water.
Elie Wiesel,"activism,apathy,hate,indifference,inspirational,love,opposite,philosophy","The opposite of love is not hate, it's indifference. The opposite of art is not ugliness, it's indifference. The opposite of faith is not heresy, it's indifference. And the opposite of life is not death, it's indifference."
Friedrich Nietzsche,"friendship,lack-of-friendship,lack-of-love,love,marriage,unhappy-marriage","It is not a lack of love, but a lack of friendship that makes unhappy marriages."
Mark Twain,"aliteracy,attributed-no-source,literacy",The man who does not read has no advantage over the man who cannot read.
Gordon A. Eadie,"belief,integrity,misattributed-to-malcolm-x,misattributed-to-rosa-parks",If you don't stand for something you will fall for anything.
"douglas adams,","life,navigation","I may not have gone where I intended to go, but I think I have ended up where I needed to be."
"J.K. Rowling,",mischief,I solemnly swear that I am up to no good.
"Pablo Neruda,","love,poetry","I love you without knowing how, or when, or from where. I love you simply, without problems or pride: I love you in this way because I do not know any other way of loving but this, in which there is no I or you, so intimate that your hand upon my chest is my hand, so intimate that when I fall asleep your eyes close."
"Groucho Marx,","animals,books,dogs,friends,humor","Outside of a dog, a book is man's best friend. Inside of a dog it's too dark to read."
Albert Einstein,"1929,imagination,inspirational,viereck-interview",I am enough of an artist to draw freely upon my imagination. Imagination is more important than knowledge. Knowledge is limited. Imagination encircles the world.
Dr. Seuss,fantasy,"I like nonsense, it wakes up the brain cells. Fantasy is a necessary ingredient in living."
"William Shakespeare,","do-wrong,love,trust,wrong","Love all, trust a few, do wrong to none."
"Neil Gaiman,",love,Have you ever been in love? Horrible isn't it? It makes you so vulnerable. It opens your chest and it opens up your heart and it means that someone can get inside you and mess you up.
Steve Martin,"humor,obvious,simile","A day without sunshine is like, you know, night."
Mark Twain,"humor,procrastination",Never put off till tomorrow what may be done day after tomorrow just as well.
"George R.R. Martin,","read,readers,reading,reading-books","A reader lives a thousand lives before he dies, said Jojen. The man who never reads lives only one."
"Kent M. Keith,","forgiveness,goodness,happiness,honesty,kindness,misattributed-to-mother-teresa,world",
"Dr. Seuss,",inspirational,You have brains in your head. You have feet in your shoes. You can steer yourself any direction you choose. You're on your own. And you know what you know. And YOU are the one who'll decide where to go...
Friedrich Nietzsche,"paraphrased,strength",That which does not kill us makes us stronger.
Lao Tzu,"courage,deeply-loved,love,strength,widely-misattributed","Being deeply loved by someone gives you strength, while loving someone deeply gives you courage."
George Eliot,"inspirational,source-unknown",It is never too late to be what you might have been.
Ralph Waldo Emerson,happiness,For every minute you are angry you lose sixty seconds of happiness.
"J.K. Rowling,","courage,friends","It takes a great deal of bravery to stand up to our enemies, but just as much to stand up to our friends."
Marilyn Monroe,"attributed-no-source,friends,heartbreak,inspirational,life,love,sisters","This life is what you make it. No matter what, you're going to mess up sometimes, it's a universal truth. But the good part is you get to decide how you're going to mess it up. Girls will be your friends - they'll act like it anyway. But just remember, some come, some go. The ones that stay with you through everything - they're your true best friends. Don't let go of them. Also remember, sisters make the best friends in the world. As for lovers, well, they'll come and go too. And baby, I hate to say it, most of them - actually pretty much all of them are going to break your heart, but you can't give up because if you give up, you'll never find your soulmate. You'll never find that half who makes you whole and that goes for everything. Just because you fail once, doesn't mean you're gonna fail at everything. Keep trying, hold on, and always, always, always believe in yourself, because if you don't, then who will, sweetie? So keep your head high, keep your chin up, and most importantly, keep smiling, because life's a beautiful thing and there's so much to smile about."
"Douglas Adams,","deadlines,humor,humour,work,writing",I love deadlines. I love the whooshing noise they make as they go by.
Mother Teresa,attributed-no-source,"If you judge people, you have no time to love them."
"Sarah Dessen,",love,"There is never a time or place for true love. It happens accidentally, in a heartbeat, in a single flashing, throbbing moment."
"John Green,",,My thoughts are stars I cannot fathom into constellations.
Albert Einstein,"attributed-no-source,simplicity,understand","If you can't explain it to a six year old, you don't understand it yourself."
Friedrich Nietzsche,"lies,lying,trust","I'm not upset that you lied to me, I'm upset that from now on I can't believe you."
"Robert A. Heinlein,","essential,happiness,love",Love is that condition in which the happiness of another person is essential to your own.
"Maya Angelou,","1970,inspirational,stories,writing",There is no greater agony than bearing an untold story inside you.
Garrison Keillor,"humor,religion",Anyone who thinks sitting in church can make you a Christian must also think that sitting in a garage can make you a car.
Jorge Luis Borges,"books,library",I have always imagined that Paradise will be a kind of library.
"Haruki Murakami,","books,thought","If you only read the books that everyone else is reading, you can only think what everyone else is thinking."
Pablo Picasso,"art,imagination,inspirational,life",Everything you can imagine is real.
Robert A. Heinlein,"cats,humor,women","Women and cats will do as they please, and men and dogs should relax and get used to the idea."
Anaïs Nin,,"We don't see things as they are, we see them as we are."
Dr. Seuss,"attributed-no-source,life",Sometimes the questions are complicated and the answers are simple.
Bob Marley,love,"You may not be her first, her last, or her only. She loved before she may love again. But if she loves you now, what else matters? She's not perfect—you aren't either, and the two of you may never be perfect together but if she can make you laugh, cause you to think twice, and admit to being human and making mistakes, hold onto her and give her the most you can. She may not be thinking about you every second of the day, but she will give you a part of her that she knows you can break—her heart. So don't hurt her, don't change her, don't analyze and don't expect more than she can give. Smile when she makes you happy, let her know when she makes you mad, and miss her when she's not there."
"Lemony Snicket,","books,reading",Never trust anyone who has not brought a book with them.
"Suzanne Collins,","katniss,love,peeta,suzanne-collins,the-hunger-games","You love me. Real or not real?"""
"William Nicholson,","misattributed-to-c-s-lewis,reading",We read to know we're not alone.
C.S. Lewis,"books,inspirational,reading,tea",You can never get a cup of tea large enough or a book long enough to suit me.
"John Green,","books,power-of-words,reading","Sometimes, you read a book and it fills you with this weird evangelical zeal, and you become convinced that the shattered world will never be put back together unless and until all living humans read the book."
Charles M. Schulz,"chocolate,food,humor",All you need is love. But a little chocolate now and then doesn't hurt.
Jim Henson,humor,Beauty is in the eye of the beholder and it may be necessary from time to time to give a stupid or misinformed beholder a black eye.
"J.K. Rowling,",dumbledore,"Of course it is happening inside your head, Harry, but why on earth should that mean that it is not real?"
J.K. Rowling,,"It is impossible to live without failing at something, unless you live so cautiously that you might as well not have lived at all - in which case, you fail by default."
"Dr. Seuss,","comedy,life,yourself","Today you are You, that is truer than true. There is no one alive who is Youer than You."
George Bernard Shaw,"inspirational,life,yourself",Life isn't about finding yourself. Life is about creating yourself.
"J.K. Rowling,","death,inspirational","To the well-organized mind, death is but the next great adventure."
Woody Allen,"death,fear,humor,life",I'm not afraid of death; I just don't want to be there when it happens.
Oscar Wilde,"books,reading","If one cannot enjoy reading a book over and over again, there is no use in reading it at all."
Albert Einstein,"attributed-no-source,children,fairy-tales","If you want your children to be intelligent, read them fairy tales. If you want them to be more intelligent, read them more fairy tales."
"Cassandra Clare,","city-of-bones,jace",Have you fallen in love with the wrong person yet?'
Albert Einstein,"attributed-no-source,imagination",Logic will get you from A to Z; imagination will get you everywhere.
Paul   Terry,"exercise,humor,laziness,misattributed-to-hutchins","Whenever I feel the need to exercise, I lie down until it goes away."
"John Green,","doomed,inevitable,love,oblivion,pleasure,simple","I'm in love with you,"" he said quietly."
"Nicholas Sparks,",love,"I am nothing special, of this I am sure. I am a common man with common thoughts and I've led a common life. There are no monuments dedicated to me and my name will soon be forgotten, but I've loved another with all my heart and soul, and to me, this has always been enough.."
"Markus Zusak,","beauty,life",Sometimes people are beautiful.
"John Green,","satisfaction,self-determination",You don't get to choose if you get hurt in this world...but you do have some say in who hurts you. I like my choices.
"Dr. Seuss,","learning,reading,seuss","The more that you read, the more things you will know. The more that you learn, the more places you'll go."
Bob Marley,friendship,"The truth is, everyone is going to hurt you. You just got to find the ones worth suffering for."
Abraham Lincoln,"attributed-no-source,happiness",Folks are usually about as happy as they make their minds up to be.
"William Shakespeare,",love,"Love looks not with the eyes, but with the mind,"
Theodore Roosevelt,inspirational,"Do what you can, with what you have, where you are."
Bob Marley,music,"One good thing about music, when it hits you, you feel no pain."
Ernest Hemingway,"books,friends,novelist-quotes",There is no friend as loyal as a book.
Groucho Marx,"books,humor,reading,television","I find television very educating. Every time somebody turns on the set, I go into the other room and read a book."
Mother Teresa,"misattributed-to-mother-teresa,paraphrased",Not all of us can do great things. But we can do small things with great love.
"Douglas Adams,","humor,scifi",The story so far:
"Nicholas Sparks,","love,simile","Love is like the wind, you can't see it but you can feel it."
"Joan Powers,","friendship,misattributed-a-a-milne","If you live to be a hundred, I want to live to be a hundred minus one day so I never have to live without you."
Shel Silverstein,"anything-can-be,hope,impossible,inspirational,musn-t,possibilities,shouldn-t,won-t","Listen to the mustn'ts, child. Listen to the don'ts. Listen to the shouldn'ts, the impossibles, the won'ts. Listen to the never haves, then listen close to me... Anything can happen, child. Anything can be."
Helen Keller,inspirational,"When one door of happiness closes, another opens; but often we look so long at the closed door that we do not see the one which has been opened for us."
Winston S. Churchill,"bravery,courage,failure,inspirational,success","Success is not final, failure is not fatal: it is the courage to continue that counts."
John Green,"humor,nerdfighters","Saying 'I notice you're a nerd' is like saying, 'Hey, I notice that you'd rather be intelligent than be stupid, that you'd rather be thoughtful than be vapid, that you believe that there are things that matter more than the arrest record of Lindsay Lohan. Why is that?' In fact, it seems to me that most contemporary insults are pretty lame. Even 'lame' is kind of lame. Saying 'You're lame' is like saying 'You walk with a limp.' Yeah, whatever, so does 50 Cent, and he's done all right for himself."
"J.K. Rowling,",dumbledore,"It matters not what someone is born, but what they grow to be."
"Elizabeth Gilbert,",love,"People think a soul mate is your perfect fit, and that's what everyone wants. But a true soul mate is a mirror, the person who shows you everything that is holding you back, the person who brings you to your own attention so you can change your life."
"Jodi Picoult,","imperfect,love","You don't love someone because they're perfect, you love them in spite of the fact that they're not."
Albert Einstein,"life,simile","Life is like riding a bicycle. To keep your balance, you must keep moving."
"Stephen Chbosky,","charlie,favourite-books,inspirational,sad,soul-searching,wallflower","So, this is my life. And I want you to know that I am both happy and sad and I'm still trying to figure out how that could be."
Alexandre Dumas-fils,misattributed-to-einstein,The difference between genius and stupidity is: genius has its limits.
"Jane Austen,","friendship,love","There is nothing I would not do for those who are really my friends. I have no notion of loving people by halves, it is not my nature."
"Walter M. Miller Jr.,","body-soul,misattributed-to-c-s-lewis",You don’t
Charles Bukowski,humor,Some people never go crazy. What truly horrible lives they must lead.
Marilyn Monroe,"attributed-no-source,girls,love","If you can make a woman laugh, you can make her do anything."
"Robert Fulghum,","love,weirdness","We’re all a little weird. And life is a little weird. And when we find someone whose weirdness is compatible with ours, we join up with them and fall into mutually satisfying weirdness—and call it love—true love."
Anais Nin,"death,love","Love never dies a natural death. It dies because we don't know how to replenish its source. It dies of blindness and errors and betrayals. It dies of illness and wounds; it dies of weariness, of witherings, of tarnishings."
"J.D. Salinger,","authors,books,literature,reading,writing","What really knocks me out is a book that, when you're all done reading it, you wish the author that wrote it was a terrific friend of yours and you could call him up on the phone whenever you felt like it. That doesn't happen much, though."
"Virginia Woolf,",women,"I would venture to guess that Anon, who wrote so many poems without signing them, was often a woman."
"John Green,","infinity,john-green,life,tfios,the-fault-in-our-stars",Some infinities are bigger than other infinities.
Eleanor Roosevelt,"attributed,fear,inspiration",Do one thing every day that scares you.
Oscar Wilde,"books,reading",It is what you read when you don't have to that determines what you will be when you can't help it.
"Terry Pratchett,","humor,open-mind,thinking","The trouble with having an open mind, of course, is that people will insist on coming along and trying to put things in it."
Alfred Tennyson,"friendship,love",If I had a flower for every time I thought of you...I could walk through my garden forever.
