author,tags,text
"Roy T. Bennett,","dreams,fearless,heart,inspiration,inspirational,inspirational-attitude,inspirational-life,inspirational-quotes,inspire,inspiring,life,life-and-living,life-lessons,life-quotes,living,mind,motivation,motivational,optimism,optimistic,positive,positive-affirmation,positive-life,positive-thinking",Don't be pushed around by the fears in your mind. Be led by the dreams in your heart.
"Dale Carnegie,","attitude,contentment,happiness,inspirational,life",It isn't what you have or who you are or where you are or what you are doing that makes you happy or unhappy. It is what you think about it.
Cicero,books,"If you have a garden and a library, you have everything you need."
Audrey Hepburn,laughter,"I love people who make me laugh. I honestly think it's the thing I like most, to laugh. It cures a multitude of ills. It's probably the most important thing in a person."
"Ursula K. Le Guin,",love,"Love doesn't just sit there, like a stone, it has to be made, like bread; remade all the time, made new."
"Haruki Murakami,","healing,vulnerability","What happens when people open their hearts?"""
"Nicholas Sparks,","love,nicholas,nicholas-sparks,sparks,the-notebook","My daddy said, that the first time you fall in love, it changes you forever and no matter how hard you try, that feeling just never goes away."
Oscar Wilde,"creation,god,humor,man","I think God, in creating man, somewhat overestimated his ability."
Irwin Shaw,,"There are too many books I haven’t read, too many places I haven’t seen, too many memories I haven’t kept long enough."
"Suzanne Collins,","inspirational,love","What I need is the dandelion in the spring. The bright yellow that means rebirth instead of destruction. The promise that life can go on, no matter how bad our losses. That it can be good again."
Albert Camus,attributed-no-source,"Should I kill myself, or have a cup of coffee?"
Pablo Picasso,"art,attributed-no-source",Every child is an artist. The problem is how to remain an artist once he grows up.
"Marilyn Monroe,",,"I don't mind living in a man's world, as long as I can be a woman in it."
Bob Marley,,Some people feel the rain. Others just get wet.
"Henry Rollins,","life,love,relationships","It hurts to let go. Sometimes it seems the harder you try to hold on to something or someone the more it wants to get away. You feel like some kind of criminal for having felt, for having wanted. For having wanted to be wanted. It confuses you, because you think that your feelings were wrong and it makes you feel so small because it's so hard to keep it inside when you let it out and it doesn't coma back. You're left so alone that you can't explain. Damn, there's nothing like that, is there? I've been there and you have too. You're nodding your head."
Bette Davis,"clichés,double-standards,empowerment,feminism,gender,hypocrisy,misogyny,opinions,speaking-out,stereotypes,women","When a man gives his opinion, he's a man. When a woman gives her opinion, she's a bitch."
Terry Pratchett,"fantasy,humor,imagination,literature,stories",Stories of imagination tend to upset those without one.
"Antoine de Saint-Exupéry,",love,"Love does not consist of gazing at each other, but in looking outward together in the same direction."
"Paul McCartney,","beatles,inspirational,live,love,music","And, in the end"
Eleanor Roosevelt,"dreams,future,inspirational,misattributed-eleanor-roosevelt",The future belongs to those who believe in the beauty of their dreams.
Maya Angelou,"1997,annie-clark-tanner-lecture,inspirational,love,trust","I don't trust people who don't love themselves and tell me, 'I love you.' ... There is an African saying which is: Be careful when a naked person offers you a shirt."
"Jane Austen,","love,romance","I cannot fix on the hour, or the spot, or the look or the words, which laid the foundation. It is too long ago. I was in the middle before I knew that I had begun."
"Neil Gaiman,",,"Everybody has a secret world inside of them. I mean everybody. All of the people in the whole world, I mean everybody — no matter how dull and boring they are on the outside. Inside them they've all got unimaginable, magnificent, wonderful, stupid, amazing worlds... Not just one world. Hundreds of them. Thousands, maybe."
"Oscar Wilde,","drama,humor,plays",I never travel without my diary. One should always have something sensational to read in the train.
Greg Behrendt,"busy,call,dating,dating-advice,faith,greg-behrendt,guys,he-s-not-just-into-you,love,marriage,romance,true","If he’s not calling you, it’s because you are not on his mind. If he creates expectations for you, and then doesn’t follow through on little things, he will do same for big things. Be aware of this and realize that he’s okay with disappointing you. Don’t be with someone who doesn’t do what they say they’re going to do. If he’s choosing not to make a simple effort that would put you at ease and bring harmony to a recurring fight, then he doesn’t respect your feelings and needs. Busy is another word for asshole. Asshole is another word for the guy you’re dating. You deserve a fcking phone call."
Marilyn Monroe,,"The nicest thing for me is sleep, then at least I can dream."
William Faulkner,"courage,determination,hope,risk",You cannot swim for new horizons until you have courage to lose sight of the shore.
Mark Twain,"patriotism,politics","Loyalty to country ALWAYS. Loyalty to government, when it deserves it."
Winston S. Churchill,"humor,taste",My tastes are simple: I am easily satisfied with the best.
"Vladimir Nabokov,","humbert-humbert,love","It was love at first sight, at last sight, at ever and ever sight."
Agatha Christie,inspirational,"I like living. I have sometimes been wildly, despairingly, acutely miserable, racked with sorrow; but through it all I still know quite certainly that just to be alive is a grand thing."
"Rick Riordan,","deadlines,humor,procrastinate",Deadlines just aren't real to me until I'm staring one in the face.
"Walt Whitman,",poetry,"Resist much, obey little."
Charles Bukowski,,"The problem with the world is that the intelligent people are full of doubts, while the stupid ones are full of confidence."
"Mark Twain,","books,truth","Truth is stranger than fiction, but it is because Fiction is obliged to stick to possibilities; Truth isn't."
C.S. Lewis,"age,books,re-reading,reading",No book is really worth reading at the age of ten which is not equally – and often far more – worth reading at the age of fifty and beyond.
"Suzanne Collins,",,I don't want to lose the boy with the bread.
"J.K. Rowling,",humor,"You haven't got a letter on yours,"" George observed. ""I suppose she thinks you don't forget your name. But we're not stupid-we know we're called Gred and Forge."
John Green,nerdfighters,"because nerds like us are allowed to be unironically enthusiastic about stuff. Nerds are allowed to love stuff, like jump-up-and-down-in-the-chair-can’t-control-yourself love it. Hank, when people call people nerds, mostly what they’re saying is ‘you like stuff.’ Which is just not a good insult at all. Like, ‘you are too enthusiastic about the miracle of human consciousness’."
"Chuck Palahniuk,","death,scars,tyler-durden",I don't want to die without any scars.
Cassandra Clare,simon,"I am a badass, and I recognize that you, too, are a badass."
"Terry Pratchett,","adventure,change,discworld,growth,travel","Why do you go away? So that you can come back. So that you can see the place you came from with new eyes and extra colors. And the people there see you differently, too. Coming back to where you started is not the same as never leaving."
"John Green,",looking-for-alaska,"What is an ""instant"" death anyway? How long is an instant? Is it one second? Ten? The pain of those seconds must have been awful as her heart burst and her lungs collapsed and there was no air and no blood to her brain and only raw panic. What the hell is instant? Nothing is instant. Instant rice takes five minutes, instant pudding an hour. I doubt that an instant of blinding pain feels particularly instantaneous."
Gabriel García Márquez,happiness,No medicine cures what happiness cannot.
"William Shakespeare,","music,romance,unrequited-love","If music be the food of love, play on,"
"Patrick Rothfuss,","fear,name-of-the-wind,patrick-rothfuss,wisdom","There are three things all wise men fear: the sea in storm, a night with no moon, and the anger of a gentle man."
Mother Teresa,"inspirational,love","I am not sure exactly what heaven will be like, but I know that when we die and it comes time for God to judge us, he will not ask, 'How many good things have you done in your life?' rather he will ask, 'How much love did you put into what you did?"
"John Green,",memories,"The town was paper, but the memories were not."
F. Scott Fitzgerald,f-scott-fitzgerald,"Show me a hero, and I'll write you a tragedy."
Kahlil Gibran,"life,love,romance","If you love somebody, let them go, for if they return, they were always yours. If they don't, they never were."
"John Green,","john-green,the-fault-in-our-stars","It's a metaphor, see: You put the killing thing right between your teeth, but you don't give it the power to do its killing."
"Veronica Roth,",,Peter would probably throw a party if I stopped breathing.'
Mortimer J. Adler,"books,reading","In the case of good books, the point is not to see how many of them you can get through, but rather how many can get through to you."
"Cassandra Clare,","chocolate,monsters","Will looked horrified. ""What kind of monster could possibly hate chocolate?"
"Louisa May Alcott,",books,"She is too fond of books, and it has turned her brain."
"Roy T. Bennett,","creation,creative,inspiration,inspirational,inspirational-attitude,inspirational-life,inspirational-quotes,inspire,inspiring,life,life-and-living,life-lessons,life-quotes,living,optimism,optimistic,positive,positive-affirmation,positive-life,positive-thinking,worry","Instead of worrying about what you cannot control, shift your energy to what you can create."
"Suzanne Collins,",romantic,My nightmares are usually about losing you. I'm okay once I realize you're here.
C.S. Lewis,"christianity,forgiveness,god",To be a Christian means to forgive the inexcusable because God has forgiven the inexcusable in you.
Jack Kerouac,,"Live, travel, adventure, bless, and don't be sorry."
Confucious,wisdom,"By three methods we may learn wisdom: First, by reflection, which is noblest; Second, by imitation, which is easiest; and third by experience, which is the bitterest."
"Lewis Carroll,",,"She generally gave herself very good advice, (though she very seldom followed it)."
"J.R.R. Tolkien,",wisdom,"It's a dangerous business, Frodo, going out your door. You step onto the road, and if you don't keep your feet, there's no knowing where you might be swept off to."
Joan Crawford,love,"Love is a fire. But whether it is going to warm your hearth or burn down your house, you can never tell."
"Andrew  Boyd,","being-loved,completion,inspirational,love,relationships","We’re all seeking that special person who is right for us. But if you’ve been through enough relationships, you begin to suspect there’s no right person, just different flavors of wrong. Why is this? Because you yourself are wrong in some way, and you seek out partners who are wrong in some complementary way. But it takes a lot of living to grow fully into your own wrongness. And it isn’t until you finally run up against your deepest demons, your unsolvable problems—the ones that make you truly who you are—that we’re ready to find a lifelong mate. Only then do you finally know what you’re looking for. You’re looking for the wrong person. But not just any wrong person: it's got to be the right wrong person—someone you lovingly gaze upon and think, This is the problem I want to have."
Stephen King,writing,Fiction is the truth inside the lie.
"Stephen King,",writing,The road to hell is paved with adverbs.
"Douglas Adams,","humor,perspective,science","The fact that we live at the bottom of a deep gravity well, on the surface of a gas covered planet going around a nuclear fireball 90 million miles away and think this to be normal is obviously some indication of how skewed our perspective tends to be."
"Jane Austen,","anger,jane-austen,wisdom",Angry people are not always wise.
"Anonymous,","faith,god,hope,love","And now these three remain: faith, hope and love. But the greatest of these is love."
Mark Twain,"death,inspirational","I do not fear death. I had been dead for billions and billions of years before I was born, and had not suffered the slightest inconvenience from it."
"Stephen Chbosky,",,"It's just that I don't want to be somebody's crush. If somebody likes me, I want them to like the real me, not what they think I am. And I don't want them to carry it around inside. I want them to show me, so I can feel it too."
"Veronica Roth,","divergent,fear",Fear doesn't shut you down; it wakes you up
"John Green,","augustus-waters,hazel-grace",Maybe 'okay' will be our 'always
"Cassandra Clare,","cassandra-clare,city-of-bones,jace,mortal-instruments","Don't order any of the faerie food,"" said Jace, looking at her over the top of his menu. ""It tends to make humans a little crazy. One minute you're munching a faerie plum, the next minute you're running naked down Madison Avenue with antlers on your head. Not,"" he added hastily, ""that this has ever happened to me."
Anton Chekhov,"broken-glass,glass,moon,moonshine,show-don-t-tell,writing",Don't tell me the moon is shining; show me the glint of light on broken glass.
Kinky Friedman,"death,love","My dear,"
Stephen King,writing,"The most important things are the hardest to say. They are the things you get ashamed of, because words diminish them -- words shrink things that seemed limitless when they were in your head to no more than living size when they're brought out. But it's more than that, isn't it? The most important things lie too close to wherever your secret heart is buried, like landmarks to a treasure your enemies would love to steal away. And you may make revelations that cost you dearly only to have people look at you in a funny way, not understanding what you've said at all, or why you thought it was so important that you almost cried while you were saying it. That's the worst, I think. When the secret stays locked within not for want of a teller but for want of an understanding ear."
Mahatma Gandhi,"freedom,humanity,mistakes",Freedom is not worth having if it does not include the freedom to make mistakes.
Margaret Mitchell,"expectation,hope,life",Life's under no obligation to give us what we expect.
George Burns,"family,happiness,humor","Happiness is having a large, loving, caring, close-knit family in another city."
"Kurt Vonnegut,",,Everything was beautiful and nothing hurt.
"Veronica Roth,","crying,laughter,options","Sometimes crying or laughing are the only options left, and laughing feels better right now."
Bill Watterson,calvin-and-hobbes-reality,It's not denial. I'm just selective about the reality I accept.
"Markus Zusak,",,"Like most misery, it started with apparent happiness."
"William Shakespeare,","death,light,stars","When he shall die,"
Robert Louis Stevenson,"day,inspirational,judge,plant,reap,seed,seeds,sow",Don't judge each day by the harvest you reap but by the seeds that you plant.
Mahatma Gandhi,"fighting,hurt,inner-peace,peace,permission,strength,trial",Nobody can hurt me without my permission.
"Rick Riordan,","humor,true-love","Love conquers all,"" Aphrodite promised. ""Look at Helen and Paris. Did they let anything come between them?"""
"Nicholas Sparks,",love,"You are the answer to every prayer I've offered. You are a song, a dream, a whisper, and I don't know how I could have lived without you for as long as I have."
Olin Miller,"confidence,misattributed-eleanor-roosevelt,others,think,worry",You probably wouldn’t worry about what people think of you if you could know how seldom they do.
"Anne Rice,",,None of us really changes over time. We only become more fully what we are.
"Stephen Chbosky,",books-reading,"It's strange because sometimes, I read a book, and I think I am the people in the book."
"Veronica Roth,","beatrice,divergent,humor,love,tobias","I have something I need to tell you,"" he says. I run my fingers along the tendons in his hands and look back at him. ""I might be in love with you."" He smiles a little. ""I'm waiting until I'm sure to tell you, though."""
"Martin Luther King, Jr.","hope,inspirational","But I know, somehow, that only when it is dark enough can you see the stars."
"Rick Riordan,","apollo,gods,hot,olympians,percy-jackson,sun,thalia","Wow,"" Thalia muttered. ""Apollo is hot."""
"Gayle Forman,",,Sometimes you make choices in life and sometimes choices make you.
Mark Twain,age,Wrinkles should merely indicate where the smiles have been.
"Suzanne Collins,",mockingjay,"Fire is catching! And if we burn, you burn with us!"
Helen Keller,"by-anne-sullivan,emotions,feelings",The best and most beautiful things in the world cannot be seen or even touched. They must be felt with the heart
"Patrick Ness,","philosophy,wisdom",You do not write your life with words...You write it with actions. What you think is not important. It is only important what you
Edgar Allan Poe,inspiration,I was never really insane except upon occasions when my heart was touched.
"Haruki Murakami,","isolation,loneliness,sadness","Why do people have to be this lonely? What's the point of it all? Millions of people in this world, all of them yearning, looking to others to satisfy them, yet isolating themselves. Why? Was the earth put here just to nourish human loneliness?"
Raymond Carver,,Woke up this morning with a terrific urge to lie in bed all day and read.
"Paulo Coelho,","forgetting,hope,love,pain,suffering,waiting","If pain must come, may it come quickly. Because I have a life to live, and I need to live it in the best way possible. If he has to make a choice, may he make it now. Then I will either wait for him or forget him."
"Neil Gaiman,","books,bookstore,towns","What I say is, a town isn’t a town without a bookstore. It may call itself a town, but unless it’s got a bookstore, it knows it’s not foolin’ a soul."
Rudyard Kipling,words,"Words are, of course, the most powerful drug used by mankind."
Mawlana Jalal-al-Din Rumi,"attraction,rumi,sufi",What you seek is seeking you.
"Harper Lee,",,"People generally see what they look for, and hear what they listen for."
Flannery O'Connor,truth,The truth does not change according to our ability to stomach it.
"J.K. Rowling,","ferret-malfoy,harry-potter,humor,ron-weasley","Don't talk to me."""
"Suzanne Collins,","love,romance","I can feel Peeta press his forehead into my temple and he asks, 'So now that you've got me, what are you going to do with me?' I turn into him. 'Put you somewhere you can't get hurt."
Anne Tyler,,I read so I can live more than one life in more than one place.
Bob Marley,"bob-marley,inspirational,music,reggae",None but ourselves can free our minds.
Muhammad Ali,friendship,"Friendship is the hardest thing in the world to explain. It's not something you learn in school. But if you haven't learned the meaning of friendship, you really haven't learned anything."
"Cassandra Clare,","jace-wayland,magnus-bane,regret,stele","I've got a stele we can use. Who wants to do me?"""
"J.K. Rowling,","dumbledore,fudge,minister,style","You know, Minister, I disagree with Dumbledore on many counts...but you cannot deny he's got style..."
"Dan Brown,",,Everything is possible. The impossible just takes longer.
Alexander Pope,"beatitudes,disappointment,expectations,hope","Blessed is he who expects nothing, for he shall never be disappointed."
Roy T. Bennett,"change,focus,grow,growth,inspiration,inspirational,inspirational-quotes,inspire,inspiring,leader,leaders,leadership,life,life-quotes,living,motivation,motivational,optimism,optimistic,positive,positive-affirmation,positive-life,positive-thinking,stay-focused,step-out-of-comfort-zone,transform","It’s only after you’ve stepped outside your comfort zone that you begin to change, grow, and transform."
"Stephen Chbosky,","esist,sleep,spinning","I don’t know if you’ve ever felt like that. That you wanted to sleep for a thousand years. Or just not exist. Or just not be aware that you do exist. Or something like that. I think wanting that is very morbid, but I want it when I get like this. That’s why I’m trying not to think. I just want it all to stop spinning."
"J.M. Barrie,",goodbye,Never say goodbye because goodbye means going away and going away means forgetting.
"Virginia Woolf,","books,metaphor,soul",Books are the mirrors of the soul.
Maya Angelou,"loneliness,music,refuge",Music was my refuge. I could crawl into the space between the notes and curl my back to loneliness.
"Lewis Carroll,","alice-in-wonderland,breakfast,carroll","Why, sometimes I've believed as many as six impossible things before breakfast."
"Paulo Coelho,",,"Everyone seems to have a clear idea of how other people should lead their lives, but none about his or her own."
"Lois Lowry,","loneliness,memories,pain,share",The worst part of holding the memories is not the pain. It's the loneliness of it. Memories need to be shared.
"Lao Tzu,","inspirational,life,philosophy","Simplicity, patience, compassion."
"J.K. Rowling,","dumbledore,friendship,harry-potter,ron-weasley","He must have known I'd want to leave you."""
Marilyn Monroe,,Who said nights were for sleep?
"Charles Dickens,","humor,laughter",There is nothing in the world so irresistibly contagious as laughter and good humor.
Taylor Swift,music,People haven't always been there for me but music always has.
"George R.R. Martin,","bravery,fear",Fear cuts deeper than swords.
J.K. Rowling,,We do not need magic to transform our world. We carry all the power we need inside ourselves already.
"Rick Riordan,",love,Be careful of love. It'll twist your brain around and leave you thinking up is down and right is wrong.
Tupac Shakur,moving-on,"You can spend minutes, hours, days, weeks, or even months over-analyzing a situation; trying to put the pieces together, justifying what could've, would've happened... or you can just leave the pieces on the floor and move the fuck on."
"Khalil Gibran,","love,marriage","Let there be spaces in your togetherness, And let the winds of the heavens dance between you. Love one another but make not a bond of love: Let it rather be a moving sea between the shores of your souls. Fill each other's cup but drink not from one cup. Give one another of your bread but eat not from the same loaf. Sing and dance together and be joyous, but let each one of you be alone, Even as the strings of a lute are alone though they quiver with the same music. Give your hearts, but not into each other's keeping. For only the hand of Life can contain your hearts. And stand together, yet not too near together: For the pillars of the temple stand apart, And the oak tree and the cypress grow not in each other's shadow."
"Cassandra Clare,","clary-fray,ego,jace-wayland","One of the Silent Brothers is here to see you. Hodge sent me to wake you up. Actually he offered to wake you himself, but since it's 5 a.m., I figured you'd be less cranky if you had something nice to look at."""
Margaret Atwood,war,War is what happens when language fails.
Maya Angelou,"attributed,attributed-no-source,education,intelligence,knowledge,unsourced","I did then what I knew how to do. Now that I know better, I do better."
"J.K. Rowling,",adventure,"Let us step into the night and pursue that flighty temptress, adventure."
"John Green,",,"I may die young, but at least I'll die smart."
E. E. Cummings,"death,life,poetry",Unbeing dead isn't being alive.
"Rick Riordan,",,"Ever had a flying burrito hit you? Well, it's a deadly projectile, right up there with cannonballs and grenades."
"Leo Tolstoy,",perfection,"If you look for perfection, you'll never be content."
David Foster Wallace,"depression,suicide","The so-called ‘psychotically depressed’ person who tries to kill herself doesn’t do so out of quote ‘hopelessness’ or any abstract conviction that life’s assets and debits do not square. And surely not because death seems suddenly appealing. The person in whom Its invisible agony reaches a certain unendurable level will kill herself the same way a trapped person will eventually jump from the window of a burning high-rise. Make no mistake about people who leap from burning windows. Their terror of falling from a great height is still just as great as it would be for you or me standing speculatively at the same window just checking out the view; i.e. the fear of falling remains a constant. The variable here is the other terror, the fire’s flames: when the flames get close enough, falling to death becomes the slightly less terrible of two terrors. It’s not desiring the fall; it’s terror of the flames. And yet nobody down on the sidewalk, looking up and yelling ‘Don’t!’ and ‘Hang on!’, can understand the jump. Not really. You’d have to have personally been trapped and felt flames to really understand a terror way beyond falling."
"Martin Luther King Jr.,","hatred,wisdom",Let no man pull you so low as to hate him.
"Markus Zusak,",death,"It kills me sometimes, how people die."
"Haruki Murakami,","disappointment,friends,friendship,life,loneliness","Nobody likes being alone that much. I don't go out of my way to make friends, that's all. It just leads to disappointment. "
Albert Einstein,"change,deep-thoughts,thinking,world",The world as we have created it is a process of our thinking. It cannot be changed without changing our thinking.
"Cassandra Clare,","humor,paranormal-romance","You guessed? You must have been pretty sure, considering you could have killed me."""
