author,tags,text
"Roy T. Bennett,","act,action,change,criticize,doing,dream,dreams,encouragement,experience,feeling,giving,inspiration,inspirational,inspirational-attitude,inspirational-life,inspirational-quote,inspirational-quotes,inspire,inspiring,learning,life,life-and-living,life-lessons,life-philosophy,life-quotes,listening,living,optimism,optimistic,ponder,positive,positive-affirmation,positive-life,positive-thinking,thinking,transform",Don't Just
A.A. Milne,,"Sometimes,' said Pooh, 'the smallest things take up the most room in your heart."
"Julian Barnes,","books,life",Books say: She did this because. Life says: She did this. Books are where things are explained to you; life is where things aren't. I'm not surprised some people prefer books.
James Baldwin,,"You think your pain and your heartbreak are unprecedented in the history of the world, but then you read."
Marilyn Monroe,"feelings,not-alone",It's often just enough to be with someone. I don't need to touch them. Not even talk. A feeling passes between you both. You're not alone.
"Suzanne Collins,","hunger-games,katniss-everdeen,love,peeta-mellark,smile,suzanne-collins",And then he gives me a smile that just seems so genuinely sweet with just the right touch of shyness that unexpected warmth rushes through me.
"Jonathan Safran Foer,","close,extremely,foer,incredibly,jonathan,living,loud,safran",I regret that it takes a life to learn how to live.
"Stephen Chbosky,","music,songs","And I thought about how many people have loved those songs. And how many people got through a lot of bad times because of those songs. And how many people enjoyed good times with those songs. And how much those songs really mean. I think it would be great to have written one of those songs. I bet if I wrote one of them, I would be very proud. I hope the people who wrote those songs are happy. I hope they feel it's enough. I really do because they've made me happy. And I'm only one person."
"Roy T. Bennett,","appreciate,change,happiness,inspiration,inspirational,inspirational-attitude,inspirational-life,inspirational-quotes,inspire,inspiring,laugh,life,life-and-living,life-lessons,life-quotes,living,love,optimism,optimistic,positive,positive-affirmation,positive-life,positive-thinking,relationship,respect,smile,value","Even if you cannot change all the people around you, you can change the people you choose to be around. Life is too short to waste your time on people who don’t respect, appreciate, and value you. Spend your life with people who make you smile, laugh, and feel loved."
"Kristin Cashore,",humor,"I'm not going to wear a red dress,"" she said."
"F. Scott Fitzgerald,","affection,amity,love","I wasn't actually in love, but I felt a sort of tender curiosity."
Kurt Vonnegut,fact,"Hello babies. Welcome to Earth. It's hot in the summer and cold in the winter. It's round and wet and crowded. On the outside, babies, you've got a hundred years here. There's only one rule that I know of, babies-""God damn it, you've got to be kind."
"J.K. Rowling,",inspirational,"It was, he thought, the difference between being dragged into the arena to face a battle to the death and walking into the arena with your head held high. Some people, perhaps, would say that there was little to choose between the two ways, but Dumbledore knew - and so do I, thought Harry, with a rush of fierce pride, and so did my parents - that there was all the difference in the world."
"Ernest Hemingway,","infatuation,love","Maybe...you'll fall in love with me all over again."""
Émile Zola,"art,calling,life","If you ask me what I came to do in this world, I, an artist, will answer you: I am here to live out loud."
John A. Shedd,"courage,inspirational,misattributed-grace-hopper,misattributed-william-g-t-shedd,risk","A ship is safe in harbor, but that's not what ships are for."
"William Shakespeare,",ferocity,"Though she be but little, she is fierce!"
"J.K. Rowling,",truth-lies,It is my belief... that the truth is generally preferable to lies.
Ray Bradbury,,"We are cups, constantly and quietly being filled. The trick is, knowing how to tip ourselves over and let the beautiful stuff out."
Ralph Waldo Emerson,"dark,stars","When it is dark enough, you can see the stars."
Washington Irving,,"There is a sacredness in tears....They are the messengers of overwhelming grief, of deep contrition and of unspeakable love."
Shel Silverstein,"dreamer,imagination,liar,make-believe,poetry,wisher,wishes",If you are a dreamer come in
"Douglas Adams,","humor,philosophy,science-fiction",Time is an illusion. Lunchtime doubly so.
Eckhart Tolle,"education,inspirational,life,philosophy,truth,wisdom",The past has no power over the present moment.
"Leigh Bardugo,",,"Kaz leaned back. ""What's the easiest way to steal a man's wallet?"""
"Stephen King,","bravery,positive-thinking,self-empowerment,writing","you can, you should, and if you’re brave enough to start, you will."
Mark Twain,clothing,Clothes make the man. Naked people have little or no influence on society.
"Roy T. Bennett,","choices,choose,inspiration,inspirational,inspirational-attitude,inspirational-life,inspirational-quotes,inspire,inspiring,life,life-and-living,life-lessons,life-quotes,living,optimism,optimistic,positive,positive-affirmation,positive-life,positive-thinking","You cannot control the behavior of others, but you can always choose how you respond to it."
Isaac Asimov,,"In life, unlike chess, the game continues after checkmate."
"Ayn Rand,","atlas,shrugged","If you don't know, the thing to do is not to get scared, but to learn."
"C.S. Lewis,","books,cry,crying,decisions","Crying is all right in its way while it lasts. But you have to stop sooner or later, and then you still have to decide what to do."
Voltaire,"double-standards,ethics,governments,humor,irony,killing,law,mankind,morality,murder,nationalism,nations,war",It is forbidden to kill; therefore all murderers are punished unless they kill in large numbers and to the sound of trumpets.
"Veronica Roth,",,We both have war inside us. Sometimes it keeps us alive. Sometimes it threatens to destroy us.
"Rick Riordan,","annabeth-chase,gold,humor,percy-jackson","The real story of the Fleece: there were these two children of Zeus, Cadmus and Europa, okay? They were about to get offered up as human sacrifices, when they prayed to Zeus to save them. So Zeus sent this magical flying ram with golden wool, which picked them up in Greece and carried them all the way to Colchis in Asia Minor. Well, actually it carried Cadmus. Europa fell off and died along the way, but that's not important."""
Johann Wolfgang von Goethe,inspiration,"If you treat an individual as he is, he will remain how he is. But if you treat him as if he were what he ought to be and could be, he will become what he ought to be and could be."
Marilyn Monroe,"animals,dogs",Dogs never bite me. Just humans.
John Cheever,,"I've been homesick for countries I've never been, and longed to be where I couldn't be."
"Roy T. Bennett,","inspiration,inspirational,inspirational-quotes,kind,kindness,life,life-quotes,living-life","Treat everyone with politeness and kindness, not because they are nice, but because you are."
Jalal Ad-Din Rumi,"islam,religion,spirituality","Knock, And He'll open the door"
George Carlin,"america,dream,funny,humor,wealth","That's why they call it the American Dream, because you have to be asleep to believe it."
Franz Kafka,"honesty,truth-telling,writing","Don't bend; don't water it down; don't try to make it logical; don't edit your own soul according to the fashion. Rather, follow your most intense obsessions mercilessly."
Rick Riordan,"percy-jackson,rachel-elizabeth-dare","I nodded, looking at Rachel with respect. ""You hit the Lord of the Titans in the eye with a blue plastic hairbrush."
"Lilith Saintcrow,","girls,inspirational,pretty,strength,women",Better to be strong than pretty and useless.
"Chuck Palahniuk,","believe,inspirational","The unreal is more powerful than the real. Because nothing is as perfect as you can imagine it. Because its only intangible ideas, concepts, beliefs, fantasies that last. Stone crumbles. Wood rots. People, well, they die. But things as fragile as a thought, a dream, a legend, they can go on and on. If you can change the way people think. The way they see themselves. The way they see the world. You can change the way people live their lives. That's the only lasting thing you can create."
"John Green,",,"Much of my life had been devoted to trying not to cry in front of people who loved me, so I knew what Augustus was doing. You clench your teeth. You look up. You tell yourself that if they see you cry, it will hurt them, and you will be nothing but a Sadness in their lives, and you must not become a mere sadness, so you will not cry, and you say all of this to yourself while looking up at the ceiling, and then you swallow even though your throat does not want to close and you look at the person who loves you and smile."
Robert Jordan,"forgiveness,men,women","Any fool knows men and women think differently at times, but the biggest difference is this. Men forget, but never forgive; women forgive, but never forget."
"Deborah Reber,","acceptance,letting-go,love,moving-on",Letting go doesn't mean that you don't care about someone anymore. It's just realizing that the only person you really have control over is yourself.
"Neil Gaiman,",,"There are so many fragile things, after all. People break so easily, and so do dreams and hearts."
"Annie Dillard,","books,literature,reading,words","She read books as one would breathe air, to fill up and live."
Søren Kierkegaard,"civil-rights,free-speech,free-will,freedom,intelligence,liberty,stupidity",People demand freedom of speech as a compensation for the freedom of thought which they seldom use.
Friedrich Nietzsche,"past,philosophy","When we are tired, we are attacked by ideas we conquered long ago."
"Antoine de Saint-Exupéry,",inspirational,"The most beautiful things in the world cannot be seen or touched, they are felt with the heart."
Anne Lamott,"grief,loss,recovery","You will lose someone you can’t live without,and your heart will be badly broken, and the bad news is that you never completely get over the loss of your beloved. But this is also the good news. They live forever in your broken heart that doesn’t seal back up. And you come through. It’s like having a broken leg that never heals perfectly—that still hurts when the weather gets cold, but you learn to dance with the limp."
Jorge Luis Borges,books,I cannot sleep unless I am surrounded by books.
Truman Capote,"experience,failure,metaphor,success,wisdom",Failure is the condiment that gives success its flavor.
"Diana Gabaldon,","claire-fraser,historical-fiction,romance,scotland,time-travel","I stood still, vision blurring, and in that moment, I heard my heart break. It was a small, clean sound, like the snapping of a flower's stem."
Alice Walker,inspirational,The most common way people give up their power is by thinking they don't have any.
"Mark Twain,",imagination,You can't depend on your eyes when your imagination is out of focus.
Paulo Coelho,"attitude,explain,gossip,life,people,public-opinion,time,wisdom",Don't waste your time with explanations: people only hear what they want to hear.
Vincent Van Gogh,,Be clearly aware of the stars and infinity on high. Then life seems almost enchanted after all.
Lemony Snicket,reading-secrets,All the secrets of the world are contained in books. Read at your own risk.
"Lucy Maud Montgomery,",happiness,It's been my experience that you can nearly always enjoy things if you make up your mind firmly that you will.
"J.K. Rowling,","humor,trees","Of all the trees we could've hit, we had to get one that hits back."
"Veronica Roth,",,"Cruelty does not make a person dishonest, the same way bravery does not make a person kind."
Walt Whitman,poetry,What is that you express in your eyes? It seems to me more than all the print I have read in my life.
Bill Watterson,"calvin-and-hobbes,humor","Sometimes when I'm talking, my words can't keep up with my thoughts. I wonder why we think faster than we speak. Probably so we can think twice."
Saul Bellow,"book-lovers,libraries,reading",People can lose their lives in libraries. They ought to be warned.
"Roy T. Bennett,","character,class,common-sense,dignity,happiness,health,inner-peace,inspiration,inspirational,inspirational-quotes,integrity,life,life-quotes,love,manners,money,morals,patience,respect,time,trust",Top 15 Things Money Can’t Buy
"Suzanne Collins,","katniss,peeta",I realize only one person will be damaged beyond repair if Peeta dies. Me.
"Stephenie Meyer,","edward,light,love,reason","Before you, Bella, my life was like a moonless night. Very dark, but there were stars, points of light and reason. ...And then you shot across my sky like a meteor. Suddenly everything was on fire; there was brilliancy, there was beauty. When you were gone, when the meteor had fallen over the horizon, everything went black. Nothing had changed, but my eyes were blinded by the light. I couldn’t see the stars anymore. And there was no more reason, for anything."
"Cassandra Clare,","clary-fray,jace-wayland,pijamas,sarcasm","Don't tell me,"" Jace said, ""Simon's turned himself into an ocelot and you want me to do something about it before Isabelle makes him into a stole. Well, you'll have have to wait till tomorrow. I'm out of commission."" He pointed at himself - he was wearing blue pajamas with a hole in the sleeve. ""Look. Jammies."""
"Neil Gaiman,",,"She says nothing at all, but simply stares upward into the dark sky and watches, with sad eyes, the slow dance of the infinite stars."
Abraham Lincoln,,"America will never be destroyed from the outside. If we falter and lose our freedoms, it will be because we destroyed ourselves."
"Kiera Cass,",,Break my heart. Break it a thousand times if you like. It was only ever yours to break anyway.
Groucho Marx,"books,humor,reading","From the moment I picked up your book until I put it down, I was convulsed with laughter. Some day I intend reading it."
Henry Miller,henry-miller,The one thing we can never get enough of is love. And the one thing we never give enough of is love.
"Nicholas Sparks,",,"Our story has three parts: a beginning, a middle, and an end. And although this is the way all stories unfold, I still can't believe that ours didn't go on forever."
Lisa Schroeder,"heartbreak,life,love","Was it hard?"" I ask."
"Thomas Mann,","authors,creative-process,struggle,writers,writing",A writer is someone for whom writing is more difficult than it is for other people.
"A.A. Milne,","patience,perseverance",Rivers know this: there is no hurry. We shall get there some day.
"Cassandra Clare,","devotion,love,love-at-first-sight,true-love","I could not tell you if I loved you the first moment I saw you, or if it was the second or third or fourth. But I remember the first moment I looked at you walking toward me and realized that somehow the rest of the world seemed to vanish when I was with you."
Friedrich Nietzsche,"agama,agnosticism,prayer,religion",I cannot believe in a God who wants to be praised all the time.
C. JoyBell C.,"forgetting,forgiving,inspirational-life,inspirational-quotes,letting-go,life,life-and-living,moving-on,people","You will find that it is necessary to let things go; simply for the reason that they are heavy. So let them go, let go of them. I tie no weights to my ankles."
Joseph Campbell,wisdom,We must be willing to let go of the life we planned so as to have the life that is waiting for us.
"Chuck Palahniuk,","future,life,past",You realize that our mistrust of the future makes it hard to give up the past.
"Douglas Adams,",life,"A learning experience is one of those things that says, 'You know that thing you just did? Don't do that."
أحمد خالد توفيق,,"أتمنى أن أبكي و أرتجف , التصق بواحد من الكبار , لكن الحقيقة القاسية هي أنك الكبار! .. أنت من يجب أن يمنح القوة و الأمن للآخرين!"
"Aldous Huxley,","brave-new-world,hunger,thirst,yearning","But I don't want comfort. I want God, I want poetry, I want real danger, I want freedom, I want goodness. I want sin."
"Markus Zusak,","children,love",A DEFINITION NOT FOUND
Rumi,love,"When I am with you, we stay up all night."
"Harper Lee,","brotherhood-of-man,people,scout",I think there's just one kind of folks. Folks.
"Markus Zusak,","hope,inspirational,life,philosophy",Maybe everyone can live beyond what they're capable of.
"Rick Riordan,","annabeth-chase,athena,percy-jackson,poseidon","What if it lines up like it did in the Trojan War ... Athena versus Poseidon?"""
Charles Bukowski,,"Some lose all mind and become soul,insane."
"John Steinbeck,",loneliness,All great and precious things are lonely.
"Fernando Pessoa,","literature,reading,solitude",Literature is the most agreeable way of ignoring life.
Will Rogers,"enterprise,humor,inertia,inspirational","Even if you are on the right track, you’ll get run over if you just sit there."
"William Shakespeare,",dramatist-quotes,Cowards die many times before their deaths;
"Jamie McGuire,",,I knew the second I met you
"Anne Frank,",,"I've found that there is always some beauty left -- in nature, sunshine, freedom, in yourself; these can all help you."
"W.G. Sebald,",,It is thanks to my evening reading alone that I am still more or less sane.
Margaret Mead,"children,education,judgement,mentoring,reasoning","Children must be taught how to think, not what to think."
Lao Tzu,"acceptance,change,life,reality,serenity",Life is a series of natural and spontaneous changes. Don't resist them; that only creates sorrow. Let reality be reality. Let things flow naturally forward in whatever way they like.
"José N. Harris,","grief,grieving,hope,loss,love,pain,sadness,strength,tears",Tears shed for another person are not a sign of weakness. They are a sign of a pure heart.
"Benjamin Franklin,",secrets,"Three may keep a secret, if two of them are dead."
Mark Twain,"animals,dogs",If you pick up a starving dog and make him prosperous he will not bite you. This is the principal difference between a dog and man.
Charles Bukowski,,Real loneliness is not necessarily limited to when you are alone.
"Jay McInerney,","family,friendship,humor",The capacity for friendship is God's way of apologizing for our families.
"J.K. Rowling,",humor,"He was my mum and dad's best friend. He's a convicted murderer, but he's broken out of wizard prison and he's on the run. He likes to keep in touch with me, though...keep up with my news...check if I'm happy..."
David Byrne,love,Sometimes it's a form of love just to talk to somebody that you have nothing in common with and still be fascinated by their presence.
Madonna,"feminism,humor,women","I'm tough, I'm ambitious, and I know exactly what I want. If that makes me a bitch, okay."
"John Guare,","future,hope",It's amazing how a little tomorrow can make up for a whole lot of yesterday.
Bob Marley,awesome,love the life you live.
"Douglas Adams,","design,foolproof,ingenuity",A common mistake that people make when trying to design something completely foolproof is to underestimate the ingenuity of complete fools.
Bob Marley,"peace,soul,wealth,wisdom","Don't Gain The World & Lose Your Soul, Wisdom Is Better Than Silver Or Gold."
"Nicholas Sparks,",,"It's possible to go on, no matter how impossible it seems, and that in time, the grief . . . lessens. It may not go away completely, but after a while it's not so overwhelming."
"Victor Hugo,",music,Music expresses that which cannot be said and on which it is impossible to be silent.
"Tamora Pierce,","humor,obedience","Every now and then I like to do as I'm told, just to confuse people."
L. Frank Baum,,Never give up... No one knows what's going to happen next.
Thomas Jefferson,"inspiration,motivation",Do you want to know who you are? Don't ask. Act! Action will delineate and define you.
"Noël Coward,","deceit,honesty,hypocrisy,morality,shock,top-8",It's discouraging to think how many people are shocked by honesty and how few by deceit.
"Dan Brown,",knowledge,Great minds are always feared by lesser minds.
"William Shakespeare,","romeo-and-juliet,shakespeare",These violent delights have violent ends
"Douglas Adams,",philosophy,"Let's think the unthinkable, let's do the undoable. Let us prepare to grapple with the ineffable itself, and see if we may not eff it after all."
"William Wordsworth,","finale-of-middlemarch,tintern-abbey","The best portion of a good man's life: his little, nameless unremembered acts of kindness and love."
"S.E. Hinton,","benediction,johnny-cade,ponyboy-curtis,ralph-macchio","Stay gold, Ponyboy, stay gold."
"F. Scott Fitzgerald,",,Let us learn to show our friendship for a man when he is alive and not after he is dead.
John Muir,"animals,caring,earth,forests,nature,plants,trees,wilderness",The clearest way into the Universe is through a forest wilderness.
Edgar Allan Poe,"beauty,imperfections",There is no exquisite beauty… without some strangeness in the proportion.
"Toni Morrison,","burdens,empowerment,flying,freedom,unburdening,weight","You wanna fly, you got to give up the shit that weighs you down."
"Charles Bukowski,",love,"I loved you like a man loves a woman he never touches, only writes to, keeps little photographs of."
"Roy T. Bennett,","belief,beliefs,believe,courage,courage-quotes,inspiration,inspirational,inspirational-quotes,inspire,inspiring,life,life-quotes,living,motivation,motivational,optimism,optimistic,positive,positive-affirmation,positive-life,positive-thinking",Be brave to stand for what you believe in even if you stand alone.
Jimi Hendrix,wisdom,"Knowledge speaks, but wisdom listens"
Lao Tzu,"life,travel",A good traveler has no fixed plans and is not intent on arriving.
Sara Henderson,,"Don't wait for a light to appear at the end of the tunnel, stride down there and light the bloody thing yourself."
"Viktor E. Frankl,",motivation,"When we are no longer able to change a situation, we are challenged to change ourselves."
Salvador Dali,"failure,fear,imperfection,mistakes,perfection,success",Have no fear of perfection - you'll never reach it.
"Cassandra Clare,","clary-fray,humor,irony,jace-wayland,jesus","What are all these?"" Clary asked."
Mark Twain,"darkness,human-nature,moon","Everyone is a moon, and has a dark side which he never shows to anybody."
"Jojo Moyes,",,You only get one life. It's actually your duty to live it as fully as possible.
Dorothy Parker,"beauty,classic-insult,humor,ugly","Beauty is only skin deep, but ugly goes clean to the bone."
"George R.R. Martin,","forcasting,mottos,winter",Winter is coming.
Abraham Lincoln,"attributed-no-source,books",My Best Friend is a person who will give me a book I have not read.
Golda Meir,"funny,golda,meir,true",Don't be so humble - you are not that great.
"Carl Sagan,","humanity,individuality,love,mercy","Every one of us is, in the cosmic perspective, precious. If a human disagrees with you, let him live. In a hundred billion galaxies, you will not find another."
Dr. Seuss,"humor,rythmic,thoughtful",Today was good. Today was fun. Tomorrow is another one.
J.R.R. Tolkien,"gondor,romance","And he took her in his arms and kissed her under the sunlit sky, and he cared not that they stood high upon the walls in the sight of many."
"Murakami, Haruki",love,"Anyone who falls in love is searching for the missing pieces of themselves. So anyone who's in love gets sad when they think of their lover. It's like stepping back inside a room you have fond memories of, one you haven't seen in a long time."
"Ralph Waldo Emerson,",greatness,"Is it so bad, then, to be misunderstood? Pythagoras was misunderstood, and Socrates, and Jesus, and Luther, and Copernicus, and Galileo, and Newton, and every pure and wise spirit that ever took flesh. To be great is to be misunderstood."
"Chuck Klosterman,","art,love,profound",Art and love are the same thing: It’s the process of seeing yourself in things that are not you.
"George Bernard Shaw,","life,philosophy,philosophy-of-life,progress",The reasonable man adapts himself to the world: the unreasonable one persists in trying to adapt the world to himself. Therefore all progress depends on the unreasonable man.
Patricia Highsmith,"conversations,distractions,imagination,quiet,solitude",My imagination functions much better when I don't have to speak to people.
"T.H. White,","curiosity,depression,education,learning,teaching","The best thing for being sad,"" replied Merlin, beginning to puff and blow, ""is to learn something. That's the only thing that never fails. You may grow old and trembling in your anatomies, you may lie awake at night listening to the disorder of your veins, you may miss your only love, you may see the world about you devastated by evil lunatics, or know your honour trampled in the sewers of baser minds. There is only one thing for it then — to learn. Learn why the world wags and what wags it. That is the only thing which the mind can never exhaust, never alienate, never be tortured by, never fear or distrust, and never dream of regretting. Learning is the only thing for you. Look what a lot of things there are to learn."
"John Green,",,"You gave me a forever within the numbered days, and I'm grateful."
Jane Goodall,inspiration,"What you do makes a difference, and you have to decide what kind of difference you want to make."
"Dan Brown,","books,dan-brown,religion,science",Science and religion are not at odds. Science is simply too young to understand.
"Becca Fitzpatrick,","humor,nora,patch","You possess other people's...bodies."""
